{
  "schema_version": 1,
  "run_id": "dep-01-local-reference",
  "profile": "local-reference",
  "scenario_path": "examples/dep-01-pure-read.json",
  "scenario_sha256": "789cfabd8f423a3a7393668a45b1e641e02398f058ab37f375cbaa80e5bee2a3",
  "seed": 17,
  "adapter": "reference",
  "decision_provider": "deterministic-approval",
  "policy": "pure-read",
  "capabilities": [
    "scenario.read",
    "artifact.write",
    "reference.execute",
    "evidence.verify"
  ],
  "limits": {
    "episodes": 1,
    "retrieval_calls": 4,
    "logical_steps": 20,
    "input_bytes": 100000,
    "memory_records": 100,
    "artifact_bytes": 2000000
  }
}
