{
  "schema_version": 1,
  "run_id": "dep-01-craf-reference",
  "profile": "local-reference",
  "scenario_path": "examples/dep-01-craf.json",
  "scenario_sha256": "ee7bb0a3e62b6fe69f89d1041054e19ffabd1a50b258ecf806257c9b1a2112ae",
  "seed": 17,
  "adapter": "reference",
  "decision_provider": "deterministic-approval",
  "policy": "craf-reference",
  "capabilities": [
    "scenario.read",
    "artifact.write",
    "reference.execute",
    "evidence.verify"
  ],
  "limits": {
    "episodes": 3,
    "retrieval_calls": 6,
    "logical_steps": 20,
    "input_bytes": 100000,
    "memory_records": 100,
    "artifact_bytes": 5000000
  }
}
